{
  "$schema": "https://json-schema.org/draft/2020-12/schema",
  "$id": "latest.schema.json",
  "title": "LOE outage schedule snapshot",
  "description": "Schema version 1 of docs/data/latest.json. Rules a JSON Schema cannot express (interval order, overlaps, the exact group set, date windows) are enforced by the pipeline's plausibility checks.",
  "type": "object",
  "additionalProperties": false,
  "required": [
    "schemaVersion",
    "sourceUrl",
    "timezone",
    "fetchedAt",
    "sourceUpdatedAt",
    "groups",
    "days"
  ],
  "properties": {
    "schemaVersion": { "const": 1 },
    "sourceUrl": { "const": "https://poweron.loe.lviv.ua/" },
    "timezone": { "const": "Europe/Kyiv" },
    "fetchedAt": {
      "description": "UTC time of the last successful fetch and validation of the source.",
      "$ref": "#/$defs/utcDateTime"
    },
    "sourceUpdatedAt": {
      "description": "Latest 'Інформація станом на' time across days; null when no day is published.",
      "oneOf": [{ "type": "null" }, { "$ref": "#/$defs/offsetDateTime" }]
    },
    "groups": {
      "description": "Group identifiers present in the source, in source order.",
      "type": "array",
      "minItems": 1,
      "uniqueItems": true,
      "items": { "$ref": "#/$defs/groupId" }
    },
    "days": {
      "description": "Published days, ascending. A missing date means data is unavailable for it.",
      "type": "array",
      "maxItems": 2,
      "items": { "$ref": "#/$defs/day" }
    }
  },
  "$defs": {
    "groupId": { "type": "string", "pattern": "^[1-9][0-9]?\\.[1-9]$" },
    "utcDateTime": {
      "type": "string",
      "format": "date-time",
      "pattern": "^\\d{4}-\\d{2}-\\d{2}T\\d{2}:\\d{2}:\\d{2}(\\.\\d{1,3})?Z$"
    },
    "offsetDateTime": {
      "description": "Kyiv wall-clock instant with its explicit UTC offset (+02:00 or +03:00).",
      "type": "string",
      "format": "date-time",
      "pattern": "^\\d{4}-\\d{2}-\\d{2}T\\d{2}:\\d{2}:00\\+0[23]:00$"
    },
    "day": {
      "type": "object",
      "additionalProperties": false,
      "required": ["date", "sourceUpdatedAt", "groups"],
      "properties": {
        "date": { "type": "string", "format": "date" },
        "sourceUpdatedAt": { "$ref": "#/$defs/offsetDateTime" },
        "groups": {
          "description": "Every known group. An empty array means no outage is scheduled.",
          "type": "object",
          "minProperties": 1,
          "propertyNames": { "$ref": "#/$defs/groupId" },
          "additionalProperties": {
            "type": "array",
            "items": { "$ref": "#/$defs/interval" }
          }
        }
      }
    },
    "interval": {
      "type": "object",
      "additionalProperties": false,
      "required": ["start", "end", "status"],
      "properties": {
        "start": { "$ref": "#/$defs/offsetDateTime" },
        "end": { "$ref": "#/$defs/offsetDateTime" },
        "status": { "enum": ["off"] }
      }
    }
  }
}
