{
  "schemaVersion": 1,
  "sourceUrl": "https://poweron.loe.lviv.ua/",
  "timezone": "Europe/Kyiv",
  "fetchedAt": "2026-10-17T19:17:05.000Z",
  "sourceUpdatedAt": "2026-10-17T21:40:00+03:00",
  "groups": [
    "1.1",
    "1.2",
    "2.1",
    "2.2",
    "3.1",
    "3.2",
    "4.1",
    "4.2",
    "5.1",
    "5.2",
    "6.1",
    "6.2"
  ],
  "days": [
    {
      "date": "2026-10-17",
      "sourceUpdatedAt": "2026-10-17T18:56:00+03:00",
      "groups": {
        "1.1": [
          {
            "start": "2026-10-17T20:00:00+03:00",
            "end": "2026-10-17T22:00:00+03:00",
            "status": "off"
          }
        ],
        "1.2": [
          {
            "start": "2026-10-17T11:00:00+03:00",
            "end": "2026-10-17T14:00:00+03:00",
            "status": "off"
          }
        ],
        "2.1": [
          {
            "start": "2026-10-17T17:00:00+03:00",
            "end": "2026-10-17T20:00:00+03:00",
            "status": "off"
          }
        ],
        "2.2": [
          {
            "start": "2026-10-17T11:00:00+03:00",
            "end": "2026-10-17T14:00:00+03:00",
            "status": "off"
          }
        ],
        "3.1": [
          {
            "start": "2026-10-17T16:00:00+03:00",
            "end": "2026-10-17T19:00:00+03:00",
            "status": "off"
          }
        ],
        "3.2": [
          {
            "start": "2026-10-17T14:00:00+03:00",
            "end": "2026-10-17T18:00:00+03:00",
            "status": "off"
          }
        ],
        "4.1": [
          {
            "start": "2026-10-17T18:00:00+03:00",
            "end": "2026-10-17T22:00:00+03:00",
            "status": "off"
          }
        ],
        "4.2": [
          {
            "start": "2026-10-17T10:00:00+03:00",
            "end": "2026-10-17T12:00:00+03:00",
            "status": "off"
          }
        ],
        "5.1": [
          {
            "start": "2026-10-17T12:00:00+03:00",
            "end": "2026-10-17T16:00:00+03:00",
            "status": "off"
          }
        ],
        "5.2": [
          {
            "start": "2026-10-17T14:00:00+03:00",
            "end": "2026-10-17T17:00:00+03:00",
            "status": "off"
          }
        ],
        "6.1": [
          {
            "start": "2026-10-17T14:00:00+03:00",
            "end": "2026-10-17T18:00:00+03:00",
            "status": "off"
          }
        ],
        "6.2": []
      }
    },
    {
      "date": "2026-10-18",
      "sourceUpdatedAt": "2026-10-17T21:40:00+03:00",
      "groups": {
        "1.1": [
          {
            "start": "2026-10-18T00:00:00+03:00",
            "end": "2026-10-18T02:30:00+03:00",
            "status": "off"
          }
        ],
        "1.2": [],
        "2.1": [],
        "2.2": [],
        "3.1": [],
        "3.2": [],
        "4.1": [],
        "4.2": [],
        "5.1": [],
        "5.2": [],
        "6.1": [],
        "6.2": []
      }
    }
  ]
}
