{
  "schemaVersion": 1,
  "sourceUrl": "https://poweron.loe.lviv.ua/",
  "timezone": "Europe/Kyiv",
  "fetchedAt": "2026-10-17T19:47:12.345Z",
  "sourceUpdatedAt": "2026-10-17T18:56:00+03:00",
  "groups": [
    "1.1",
    "1.2",
    "2.1",
    "2.2",
    "3.1",
    "3.2",
    "4.1",
    "4.2",
    "5.1",
    "5.2",
    "6.1",
    "6.2"
  ],
  "days": [
    {
      "date": "2026-10-17",
      "sourceUpdatedAt": "2026-10-17T18:56:00+03:00",
      "groups": {
        "1.1": [],
        "1.2": [],
        "2.1": [],
        "2.2": [],
        "3.1": [],
        "3.2": [],
        "4.1": [],
        "4.2": [],
        "5.1": [],
        "5.2": [],
        "6.1": [],
        "6.2": []
      }
    }
  ]
}
